[
  {
    "id": "E1-S01",
    "pagina": 2,
    "pagina_fin": 2,
    "hablante": "[Enlace ADIP]",
    "atribucion": "Por continuidad del turno y referencias del diálogo",
    "fragmento_literal": "[Directora ADIP] es la directora responsable del proyecto de Cartovisor.",
    "codigos": [
      "C00"
    ],
    "estatus": "contexto",
    "memo": "Ubica a la responsable del proyecto; no equivale a identificar a todos los usuarios.",
    "revision_humana": "pendiente"
  },
  {
    "id": "E1-S02",
    "pagina": 3,
    "pagina_fin": 3,
    "hablante": "[Directora ADIP]",
    "atribucion": "Por continuidad del turno y referencias del diálogo",
    "fragmento_literal": "Tengo aquí a cargo la dirección de monitoreo electrónico y procesamiento estadístico.",
    "codigos": [
      "C00"
    ],
    "estatus": "contexto",
    "memo": "La responsabilidad declarada explica su perspectiva institucional.",
    "revision_humana": "pendiente"
  },
  {
    "id": "E1-S03",
    "pagina": 4,
    "pagina_fin": 4,
    "hablante": "[Directora ADIP]",
    "atribucion": "Por continuidad del turno y referencias del diálogo",
    "fragmento_literal": "Como les decía, esto es lo que consume como la mayor parte del día. Sin embargo, pues el equipo tiene diferentes proyectos.",
    "codigos": [
      "C00",
      "C17"
    ],
    "estatus": "situacion_actual",
    "memo": "El tablero delictivo pertenece al contexto laboral. No trasladar automáticamente sus funciones al nuevo visor.",
    "revision_humana": "pendiente"
  },
  {
    "id": "E1-S04",
    "pagina": 4,
    "pagina_fin": 4,
    "hablante": "[Directora ADIP]",
    "atribucion": "Por continuidad del turno y referencias del diálogo",
    "fragmento_literal": "me gustaría que empezáramos a lo mejor con algunas capas muy sencillas.",
    "codigos": [
      "C09",
      "C17"
    ],
    "estatus": "requisito_expresado",
    "memo": "Propone empezar con un alcance acotado; posteriormente especifica las dos capas.",
    "revision_humana": "pendiente"
  },
  {
    "id": "E1-S05",
    "pagina": 5,
    "pagina_fin": 5,
    "hablante": "[Directora ADIP]",
    "atribucion": "Por continuidad del turno y referencias del diálogo",
    "fragmento_literal": "Cada una o la mayoría ahorita está utilizando o está intentando georreferenciar o utilizar mapas para diferentes situaciones.",
    "codigos": [
      "C01"
    ],
    "estatus": "situacion_actual",
    "memo": "Describe diversidad de usos desde su perspectiva; no es una medición de adopción ni inventario completo.",
    "revision_humana": "pendiente"
  },
  {
    "id": "E1-S06",
    "pagina": 5,
    "pagina_fin": 5,
    "hablante": "[Directora ADIP]",
    "atribucion": "Por continuidad del turno y referencias del diálogo",
    "fragmento_literal": "Hay muchas capas. Entonces todo el mundo utiliza capas diferentes. Y al hacer esos cruces pues nos salen a todos resultados diferentes.",
    "codigos": [
      "C01"
    ],
    "estatus": "situacion_actual",
    "memo": "Relaciona las referencias cartográficas distintas con resultados distintos; el mecanismo es narrado, no una prueba causal.",
    "revision_humana": "pendiente"
  },
  {
    "id": "E1-S07",
    "pagina": 5,
    "pagina_fin": 5,
    "hablante": "[Directora ADIP]",
    "atribucion": "Por continuidad del turno y referencias del diálogo",
    "fragmento_literal": "Entonces el plan es homologar toda esta información para que existiera como una especie de datos abiertos.",
    "codigos": [
      "C02"
    ],
    "estatus": "requisito_expresado",
    "memo": "La biblioteca común es la respuesta propuesta al problema de referencias dispersas.",
    "revision_humana": "pendiente"
  },
  {
    "id": "E1-S08",
    "pagina": 5,
    "pagina_fin": 5,
    "hablante": "[Directora ADIP]",
    "atribucion": "Por continuidad del turno y referencias del diálogo",
    "fragmento_literal": "bueno, vamos a empezar de adentro hacia afuera, tuviéramos como todos esa liga y pudiéramos consumir de ella.",
    "codigos": [
      "C02",
      "C04",
      "C17"
    ],
    "estatus": "requisito_expresado",
    "memo": "El acceso inicial es institucional; la apertura pública es una ampliación posible.",
    "revision_humana": "pendiente"
  },
  {
    "id": "E1-S09",
    "pagina": 6,
    "pagina_fin": 6,
    "hablante": "[Directora ADIP]",
    "atribucion": "Por continuidad del turno y referencias del diálogo",
    "fragmento_literal": "Cualquier persona. O sea, el tema es que lo pueda utilizar cualquier persona.",
    "codigos": [
      "C13"
    ],
    "estatus": "aspiracion",
    "memo": "Expresa facilidad de uso deseada; no demuestra que ya existan perfiles de usuario validados.",
    "revision_humana": "pendiente"
  },
  {
    "id": "E1-S10",
    "pagina": 6,
    "pagina_fin": 6,
    "hablante": "[Directora ADIP]",
    "atribucion": "Por continuidad del turno y referencias del diálogo",
    "fragmento_literal": "Yo no sé el trabajo de las demás dependencias, no conozco incluso la actualización de las demás dependencias y si van a utilizar la cartografía o no.",
    "codigos": [
      "C03"
    ],
    "estatus": "incertidumbre_explicita",
    "memo": "Los casos de uso interinstitucionales deben investigarse directamente con esas dependencias.",
    "revision_humana": "pendiente"
  },
  {
    "id": "E1-S11",
    "pagina": 6,
    "pagina_fin": 6,
    "hablante": "[Directora ADIP]",
    "atribucion": "Por continuidad del turno y referencias del diálogo",
    "fragmento_literal": "Yo lo que únicamente quiero es tener como una biblioteca que pudieran consultarla en cualquier momento cualquier persona, cualquier persona que tuviera el INC, porque todavía no va a ser público, y ¿en qué momento? En el momento que sea.",
    "codigos": [
      "C02",
      "C04"
    ],
    "estatus": "requisito_expresado",
    "memo": "La palabra INC se conserva como aparece en el transcript; el contexto refiere al enlace. No usarla como nombre técnico de un sistema.",
    "revision_humana": "pendiente"
  },
  {
    "id": "E1-S12",
    "pagina": 6,
    "pagina_fin": 6,
    "hablante": "[Directora ADIP]",
    "atribucion": "Por continuidad del turno y referencias del diálogo",
    "fragmento_literal": "No, nadie me lo ha solicitado.",
    "codigos": [
      "C03"
    ],
    "estatus": "incertidumbre_explicita",
    "memo": "No se documenta una solicitud previa del Carto-Visor a esta entrevistada; no significa que nadie utilice cartografía.",
    "revision_humana": "pendiente"
  },
  {
    "id": "E1-S13",
    "pagina": 6,
    "pagina_fin": 6,
    "hablante": "[Directora ADIP]",
    "atribucion": "Por continuidad del turno y referencias del diálogo",
    "fragmento_literal": "Esas dos capas, la fuente es Secretaría de Seguridad Ciudadana, pero si me pidieran la actualización de esas dos capas, yo no se las puedo dar.",
    "codigos": [
      "C07",
      "C11"
    ],
    "estatus": "situacion_actual",
    "memo": "ADIP no debe presentarse como productora de los polígonos ni prometer actualizarlos autónomamente.",
    "revision_humana": "pendiente"
  },
  {
    "id": "E1-S14",
    "pagina": 6,
    "pagina_fin": 6,
    "hablante": "[Directora ADIP]",
    "atribucion": "Por continuidad del turno y referencias del diálogo",
    "fragmento_literal": "Yo tendría que solicitarla a quien hace, al dueño de la información, en este caso la Secretaría, y proporcionárselas al técnico para que suba la actualización.",
    "codigos": [
      "C07",
      "C18"
    ],
    "estatus": "proceso_propuesto",
    "memo": "Distingue productor, enlace y técnico. La actualización depende primero del productor.",
    "revision_humana": "pendiente"
  },
  {
    "id": "E1-S15",
    "pagina": 7,
    "pagina_fin": 7,
    "hablante": "[Directora ADIP]",
    "atribucion": "Por continuidad del turno y referencias del diálogo",
    "fragmento_literal": "Sí, pues mira, que alguien tenga la necesidad, actualmente no, nadie. Yo o el titular y yo lo platicamos porque es un proyecto totalmente nuevo, a nadie se le ha ocurrido, nadie lo ha proporcionado y es como dejar de hacer lo que todos quieran o consuman lo que quieran, actualizado o no, y homologar la información que sale de la Ciudad de México.",
    "codigos": [
      "C02",
      "C03"
    ],
    "estatus": "incertidumbre_explicita",
    "memo": "La iniciativa parte de una conversación interna. Su utilidad para terceros sigue siendo una hipótesis de diseño.",
    "revision_humana": "pendiente"
  },
  {
    "id": "E1-S16",
    "pagina": 7,
    "pagina_fin": 7,
    "hablante": "[Directora ADIP]",
    "atribucion": "Por continuidad del turno y referencias del diálogo",
    "fragmento_literal": "Yo tengo algunos contactos con algunas secretarías y me lo proporcionan como de manera en corto, por WhatsApp, algunos se tienen que hacer por oficio, pero desconozco cómo lo hagan las demás personas.",
    "codigos": [
      "C18",
      "C03"
    ],
    "estatus": "situacion_actual",
    "memo": "Estos canales describen su experiencia; no se generalizan a todo el gobierno ni permiten medir tiempos de entrega.",
    "revision_humana": "pendiente"
  },
  {
    "id": "E1-S17",
    "pagina": 8,
    "pagina_fin": 8,
    "hablante": "[Participante ADIP] de ADIP",
    "atribucion": "Por continuidad del turno y referencias del diálogo",
    "fragmento_literal": "con sus muy bien asignados permisos para que no sean accesibles por cualquiera, que solo sean accesibles por las dependencias que así lo requieran",
    "codigos": [
      "C04"
    ],
    "estatus": "requisito_expresado",
    "memo": "Plantea acceso por permisos. No es el [Participante ADIP] estudiante mencionado en la presentación del equipo.",
    "revision_humana": "pendiente"
  },
  {
    "id": "E1-S18",
    "pagina": 8,
    "pagina_fin": 8,
    "hablante": "[Directora ADIP]",
    "atribucion": "Por continuidad del turno y referencias del diálogo",
    "fragmento_literal": "De preferencia a ambos. ¿Quién? Pues también las personas que lo consulten. Todos.",
    "codigos": [